{
  "contract": {
    "name": "hausman-hub-device-action-batch-receipt",
    "version": 1
  },
  "correlationId": "lighting-room-off-demo-1",
  "status": "partial",
  "total": 2,
  "acceptedCount": 1,
  "confirmedCount": 1,
  "failedCount": 1,
  "receipts": [
    {
      "contract": {"name": "hausman-hub-device-action-receipt", "version": 1},
      "correlationId": "lighting-room-off-demo-1",
      "requestId": "request-light-a",
      "accepted": true,
      "confirmed": true,
      "status": "confirmed",
      "statusName": "Выполнено",
      "targetId": "device-light-a",
      "actionId": "turn_off",
      "observedState": "off",
      "appliedAt": 1787400000000,
      "message": "Свет A: новое состояние подтверждено.",
      "confirmationWindowMs": 8000,
      "readBack": {
        "attempted": true,
        "matched": true,
        "observedAt": 1787400000000,
        "observedState": "off",
        "attempts": 1
      },
      "reason": null
    },
    {
      "contract": {"name": "hausman-hub-device-action-receipt", "version": 1},
      "correlationId": "lighting-room-off-demo-1",
      "requestId": "request-light-b",
      "accepted": false,
      "confirmed": false,
      "status": "failed",
      "statusName": "Не выполнено",
      "targetId": "device-light-b",
      "actionId": "turn_off",
      "message": "Команда не была отправлена устройству.",
      "confirmationWindowMs": 8000,
      "readBack": {
        "attempted": false,
        "matched": false,
        "observedAt": null,
        "observedState": null,
        "attempts": 0
      },
      "error": "device_unavailable"
    }
  ]
}
